title,company,location,salary,salary_period,job_type,posted_date,summary,url,scraped_from_page
Full Stack Developer (Web + Python) Contract Work,Darcy Solutions,"New Brighton, MN 55112",$50 - $150,hour,Contract,30+ days ago,Darcy Solutions is seeking a skilled Contract Full-Stack Developer (Web + Python) to join our growing team. This role is ideal for professionals experienced in…,https://www.indeed.com/viewjob?jk=571df1c53fd663ac,1
Research Engineer,"Galois, Inc.","Minneapolis, MN",Not mentioned,Not mentioned,Full-time,30+ days ago,"Research Engineers at Galois design and develop advanced technologies for safety- and security-critical systems, networks, and applications.",https://www.indeed.com/viewjob?jk=05ff6e129140f4e4,1
AI / ML Engineer,"Phaedon, LLC","Minneapolis, MN 55401",Not mentioned,Not mentioned,Full-time,30+ days ago,"You will be a key member of our team, responsible for building, deploying, and scaling AI-powered data products and analytics solutions that solve real client…",https://www.indeed.com/viewjob?jk=d8181bdcf0cff68c,1
Backend Engineer,"Mountain Health Technologies, Inc","Minneapolis, MN 55401",Not mentioned,Not mentioned,Full-time,30+ days ago,"You'll work with our infrastructure, data, and frontend teams to create robust, scalable systems that power our healthcare platform.",https://www.indeed.com/viewjob?jk=ae39fe9a4d4042ad,1
PTC Integrity Developer,Info-Ways,"Saint Paul, MN",Not mentioned,Not mentioned,Contract,30+ days ago,"BGV will be done for the selected candidates. Seeking a PTC Integrity Developer to build high quality, user focused custom applications utilizing PTC’s software…",https://www.indeed.com/viewjob?jk=202d0a6005692476,1
JAVA FULL STACK DEVELOPER,Code Lab Technology,"Minneapolis, MN",Not mentioned,Not mentioned,Contract,30+ days ago,"All of our consultants hold advanced level degrees, certifications, training and experience within the field of information technology.",https://www.indeed.com/viewjob?jk=4f5caea2996d2d8a,1
Azure Developer,HISTOSONICS INC,"Plymouth, MN 55446","$110,000 - $145,000",year,Full-time,27 days ago,The Azure Developer / Software Engineer is responsible for development and execution of various SW development tasks during software development process to…,https://www.indeed.com/viewjob?jk=4a81ec5c94e2a5e4,1
Senior Software Developer,Social Indoor,"Minnetonka, MN 55345","$90,000 - $115,000",year,Full-time,8 days ago,"Design, develop, and maintain web-based applications, APIs, and internal tools that support business operations. Databases include SQL Server and MySQL.",https://www.indeed.com/viewjob?jk=8dbbcf8a041a65e5,1
Senior AI Engineer,Medica Services Company LLC,"Minnetonka, MN 55305","$111,200 - $190,600",year,Full-time,30+ days ago,"Design, implement and deploy AI pipelines, systems and platforms – from evaluation design and benchmarking through product integration-ensuring performance,…",https://www.indeed.com/viewjob?jk=633b0b0d05376471,1
Software Developer(DERMS/DERS),Aspen Technology,"Medina, MN","$90,200 - $112,800",year,Full-time,30+ days ago,"Collaborate with other developers, architects, and stakeholders to design and implement best -in-class software. Ensure reliable code by developing unit tests.",https://www.indeed.com/viewjob?jk=c40b2874aa8b29d0,1
AI Software Engineer,Medica Services Company LLC,"Minnetonka, MN 55305","$98,400 - $168,600",year,Full-time,30+ days ago,"Assist in designing, implementing and deploying AI pipelines and systems—from evaluation setup and benchmarking to integration with products.",https://www.indeed.com/viewjob?jk=9838f21602ff19c6,1
Sr. Power Systems Developer,Aspen Technology,"Medina, MN","$115,100 - $143,900",year,Full-time,30+ days ago,"Model and simulate steady-state and dynamic behavior of distribution system equipment such as transformers, cables/lines, conventional and renewable generators,…",https://www.indeed.com/viewjob?jk=c8b26cf6ccfc0926,1
Data Engineering Consultant - Hybrid,Securian Financial Group,"Saint Paul, MN 55101","$84,000 - $155,000",year,Full-time,30+ days ago,You will learn and grow to stay up to date with the latest trends and technologies in this dynamic data and analytics space.,https://www.indeed.com/viewjob?jk=39f418586869e2ab,1
Senior Software Engineer - Urology R & D,Boston Scientific,"Arden Hills, MN","$86,600 - $164,500",year,Not mentioned,28 days ago,"You will leverage deep technical expertise in C++ application development, the Linux operating system, and cybersecurity to architect, develop, and deliver…",https://www.indeed.com/viewjob?jk=cef5a92caba04a8a,1
Senior AI Developer,Affinity Plus Federal Credit Union,"Saint Paul, MN 55107","$114,200 - $148,500",year,Full-time,5 days ago,5+ years of experience in a developer or similar role. The Senior AI Developer designs and implements advanced AI and intelligent automation solutions to…,https://www.indeed.com/viewjob?jk=53c0e3b8c0eb7604,1
Sr. PeopleSoft Developer,University of Minnesota,"Minneapolis, MN",Not mentioned,Not mentioned,Full-time,21 days ago,"Collaborate with functional partners, developers and support to define and understand both functional and technical requirements for PeopleSoft Systems.",https://www.indeed.com/viewjob?jk=12845d4de1f704d7,2
Computational Bio. Asst.,University of Minnesota,"Minneapolis, MN",Not mentioned,Not mentioned,Part-time,29 days ago,Programming skills in Bash and Python. The ability to document work and maintain organized code repositories in Git/GitHub.,https://www.indeed.com/viewjob?jk=9d91a313660ad0b2,2
Sr Developer - Equipment Finance Systems,Huntington Bank,"Minnetonka, MN 55305","$77,000 - $154,000",year,Full-time,11 days ago,"Work as a key technical leader and direct contributor to the work necessary to deliver on our product goals. Do the work necessary to keep our systems current,…",https://www.indeed.com/viewjob?jk=8e21cb58e01b7e7a,2
"Software Engineer II (AWS, Node, React, Python, SQL, Databricks)","The Travelers Companies, Inc.","Saint Paul, MN 55101","$120,400 - $198,700",year,Not mentioned,22 days ago,The annual base salary range provided for this position is a nationwide market range and represents a broad range of salaries for this role across the country.,https://www.indeed.com/viewjob?jk=a44fe3a293d26adb,2
"Senior Software Engineer - Tech Lead (AWS, Node, React, Python, SQL, Databricks)","The Travelers Companies, Inc.","Saint Paul, MN 55101","$139,400 - $230,000",year,Not mentioned,30+ days ago,The annual base salary range provided for this position is a nationwide market range and represents a broad range of salaries for this role across the country.,https://www.indeed.com/viewjob?jk=2f0b74c0e630631c,2
"Full Stack Web Developer - Entry Level - Saint Louis Park, MN",Aston Technologies Inc.,"Saint Louis Park, MN",$25 - $-1,hour,Not mentioned,30+ days ago,"When on a project, our software developers solve technical challenges, document solutions, resolve bugs, and allocate resources to deliver solutions for the…",https://www.indeed.com/viewjob?jk=a3f0e04c136e6e5f,2
(Python Based) Senior Research Engineer,Thomson Reuters,"Eagan, MN 55121","$126,000 - $234,000",year,Full-time,30+ days ago,We support the organization and our customers through applied research and the development of new products and technologies.,https://www.indeed.com/viewjob?jk=8dd2f7c20d441257,2
"Senior Deep Learning Software Engineer, Inference",NVIDIA,Minnesota,Not mentioned,Not mentioned,Full-time,30+ days ago,"You’ll work closely with the deep learning community to implement the latest algorithms for public release in frameworks like SGLang and vLLM, as well as other…",https://www.indeed.com/viewjob?jk=1ee311941b389ee3,2
Sr Software Developer,Aspen Technology,"Medina, MN","$109,600 - $137,000",year,Full-time,1 day ago,"With this role, you will help to build a variety of applications, services, and visualization tools made for enabling our utility customers to optimize their…",https://www.indeed.com/viewjob?jk=27fb092f7bbb7fd7,2
Associate Software Developer,Aspen Technology,"Medina, MN","$70,700 - $88,400",year,Full-time,1 day ago,"Collaborate with other developers, architects, and stakeholders to design and implement best-in-class software. Specific on-the-job training will be provided.",https://www.indeed.com/viewjob?jk=e60df3fc792a698c,2
"Entry-Level Developer (Full-Time, On-Site – Downtown Minneapolis)",Remarqable,"Minneapolis, MN 55402",$20 - $-1,hour,Full-time,1 day ago,Mentorship: work directly with an experienced founder and developer. We’re looking for an entry-level or junior developer who’s passionate about building real-…,https://www.indeed.com/viewjob?jk=48d143aea8985c68,2
"Lead Machine Learning / AI Engineer - Personalization (Python, PySpark, ML Ops)",Target,"Brooklyn Park, MN 55445","$128,000 - $231,000",year,Full-time,5 days ago,Pay is based on several factors which vary based on position. Target offers eligible team members and their dependents comprehensive health benefits and…,https://www.indeed.com/viewjob?jk=0af7b1dc708f5426,2
Software Engineering Manager - Cloud and Web,Starkey Laboratories,"Eden Prairie, MN 55344","$126,280 - $152,250",year,Full-time,15 days ago,The Software Engineering Manager will manage the development of cloud and web-based solutions for its mobile and telehealth products.,https://www.indeed.com/viewjob?jk=06004bee3b41b4d7,2
CMake Engineer,Kitware,"Minneapolis, MN","$75,000 - $120,000",year,Full-time,19 days ago,Kitware is seeking a Software Developer with CMake experience for the Software Solutions team. Kitware works in a variety of exciting scientific computing…,https://www.indeed.com/viewjob?jk=b9b4a3befa256cfe,2
Senior Engineer,Sportsdigita,"Edina, MN 55435",Not mentioned,Not mentioned,Full-time,22 days ago,"The role requires the ability to balance elegant, user-friendly interfaces with the technical depth needed to ensure scalability, security, and performance for…",https://www.indeed.com/viewjob?jk=cd09bfb07f75430c,2
